video_url,user_url,username,title,view_num,created_at,shortdesc,collected_at
/watch?v=S7oMM6o96UU&pp=ygUJcmFjZU1pYW1p,/@redbullracing,Oracle Red Bull Racing,Race To Miami | Sergio Perez takes a Road Trip from New York to Miami,4.3M,1 year,"As the excitement grows around the Miami Grand Prix, Checo takes a trip through the city streets of New York and the swampy ...",2024-02-03 22:27:31.985851
/watch?v=2-jvlhc7c58&pp=ygUJcmFjZU1pYW1p,/@Formula1,FORMULA 1,Race Highlights | 2023 Miami Grand Prix,6.5M,8 months,"Checo Perez started on pole, his team mate and rival Max Verstappen in 9th. Catch up on all the key moments as we took the F1 ...",2024-02-03 22:27:31.988605
/watch?v=Bixit7nxYE4&pp=ygUJcmFjZU1pYW1p,/@Formula1,FORMULA 1,Race Highlights | 2022 Miami Grand Prix,8.7M,1 year,"The championship heats up as F1 races in Miami for the very first time! For more F1® videos, visit http://www.Formula1.com Follow ...",2024-02-03 22:27:31.991232
/watch?v=3i9ihYSWV8Y&pp=ygUJcmFjZU1pYW1p,/@dreamscopefilms,Dreamscope Films ,Rally 2 Race: Miami 2022 Aftermovie | Dreamscope Films (4K),28K,1 year,"Miami was a movie!! Crazy to believe it's been a year since the first Miami rally, and brought back the heat for the second one for ...",2024-02-03 22:27:40.631193
/watch?v=Lv8vKg04bys&pp=ygUJcmFjZU1pYW1p,/@VICE,VICE,Why Miami’s Street Racers Are Turning to Legal Raceways,1M,4 years,"Street racing has long been popular in Miami with a variety of groups, some who gather at undisclosed locations off U.S. Highway ...",2024-02-03 22:27:40.634832
/watch?v=3hMSe_t_XcI&pp=ygUJcmFjZU1pYW1p,/@GreenerGrass,Jeb Brooks,TRAIN vs PLANE Race Miami to Orlando (Brightline vs Delta Air Lines),402K,3 months,Watch this video to find out whether a train can beat a plane? Brightline just opened the newest intercity train in the United States ...,2024-02-03 22:27:40.638972
/watch?v=Barxn35TtHQ&pp=ygUJcmFjZU1pYW1p,/@WorldSailingTV,World Sailing TV,"Full Laser Medal Race - Sailing's World Cup Series | Miami, USA 2018",72K,6 years,"Regatta Park, Miami, USA is hosting more than 500 sailors from 50 nations for the second of four regattas in Sailing's 2018 World ...",2024-02-03 22:27:40.654126
/watch?v=zJRswyrJ7XY&pp=ygUJcmFjZU1pYW1p,/@Formula1,FORMULA 1,Sergio Perez's Pole Lap | 2023 Miami Grand Prix | Pirelli,421K,8 months,"Sergio Perez adds another pole to his collection with this flying lap in Miami! For more F1® videos, visit https://www.Formula1.com ...",2024-02-03 22:27:40.657062
/watch?v=J7GX-URjQFk&pp=ygUJcmFjZU1pYW1p,/@cozzzymedia,Cozzzy Media,Rally 2 Race | The Miami Aftermovie 2022 | Cozzzy Media  (4K),19K,1 year,WOW! is an understatement. Having the opportunity to film my first ever rally is something I didn't think I would be doing anytime ...,2024-02-03 22:27:40.659792
/watch?v=3gqki45ZnCw&pp=ygUJcmFjZU1pYW1p,/@Topsteppa,Top_Steppa707,MIAMI FLORIDA INTERSECTION TAKEOVER *Hellcat gone wild*,1.7M,1 year,If you Haven't already Subscribed Go Ahead And Hit that Red Button And Ring The Bell Cash app info is ...,2024-02-03 22:27:40.663188
/watch?v=MgMND2Y-_S8&pp=ygUJcmFjZU1pYW1p,/@Ferrari,Ferrari,"Ferrari Challenge North America Coppa Shell - Homestead-Miami, Race 1",7.5K,Streamed 10 months,Watch all of the Ferrari Challenge action live from the Homestead-Miami Speedway. #Ferrari488ChallengeEvo ...,2024-02-03 22:27:40.666089
/watch?v=rpwklKEv38w&pp=ygUJcmFjZU1pYW1p,/@redbull,Red Bull,F1 Drivers Race TINY Jet Boats! (Daniel vs Yuki) 🚤,2.1M,8 months,"Which Formula 1 driver would win a race in MINI Jet Boats?! Ahead of the Miami Grand Prix, Daniel Ricciardo & Yuki Tsunoda ...",2024-02-03 22:27:40.670255
/shorts/6BYJ0b3_qFk,/@charles_leclerc,Charles Leclerc,Miami Post-Race Recap #shorts,168K,1 year,"Disappointed with the pace this weekend at the Miami GP, but happy to be back on a podium with Ferrari! We'll work harder ...",2024-02-03 22:27:40.674534
/watch?v=qtIVvQ8sNPw&pp=ygUJcmFjZU1pYW1p,/@redbullracing,Oracle Red Bull Racing,Max Verstappen Drives F1 Car in The Rocky Mountains 🇺🇸,6.9M,5 years,Ever seen an Formula One car rip through the Rocky Mountains and across the sand in Miami Beach? Now you have. The Red ...,2024-02-03 22:27:40.679786
/watch?v=ouDinCRMQ_g&pp=ygUJcmFjZU1pYW1p,/@redbull,Red Bull,F1 Drivers Race WILD Swamp Cars 🇺🇸 🐊,5.3M,1 year,"Ahead of the Miami Grand Prix, Formula One drivers Max Verstappen & Yuki Tsunoda turned their F1 racing skills to a new ...",2024-02-03 22:27:40.684235
/watch?v=qO7fo2EV1rs&pp=ygUJcmFjZU1pYW1p,/@Formula1,FORMULA 1,Qualifying Highlights | 2023 Miami Grand Prix,4.9M,8 months,"Watch all the best bits from a dramatic qualifying session in Miami! For more F1® videos, visit https://www.Formula1.com Follow ...",2024-02-03 22:27:40.687731
/watch?v=MUBJcQEWCh4&pp=ygUJcmFjZU1pYW1p,/@Ferrari,Ferrari,"Ferrari Challenge North America Coppa Shell - Homestead-Miami, Race 2",7.4K,Streamed 10 months,Watch all of the Ferrari Challenge action live from the Homestead-Miami Speedway. #Ferrari488ChallengeEvo ...,2024-02-03 22:27:40.692226
/watch?v=utbkq8ME2kA&pp=ygUJcmFjZU1pYW1p,/@imsaofficial,IMSA Official,Race 1 - 2023 Porsche Carrera Cup North America At Miami International Autodrome,42K,8 months,Check out the action from the Round 5 of the Porsche Carrera Cup North America at Miami International Autodrome.,2024-02-03 22:27:40.696666
/watch?v=Iw6Q-5RIGTs&pp=ygUJcmFjZU1pYW1p,/@GDAWG803,GDAWG803,"MIAMI NIGHTS 3 : Donkmaster , 2fly vs Macho | WILD UNSEEN MLK WEEKEND FOOTAGE | Donk Racing 2024",29K,5 days,"MLK WEEKEND in South Florida is always a vibe! See just how they do it in the land of the Donks , the 305! Donkmaster pulls up ...",2024-02-03 22:27:40.701709
/shorts/uALsS4PQs7Q,/@espn,ESPN,STARS are out at the F1 race in Miami ⭐️,531K,1 year,STARS are out at the F1 race in Miami ⭐️ #shorts ✔️Subscribe to ESPN+ http://espnplus.com/youtube ✔️ Get the ESPN App: ...,2024-02-03 22:27:47.763735
/watch?v=0DPAH0ONdkM&pp=ygUKcmFjZSBNaWFtaQ%3D%3D,/@NBA,NBA,"SUNS at HAWKS | FULL GAME HIGHLIGHTS | February 2, 2024",222K,19 hours,"Never miss a moment with the latest news, trending stories and highlights to bring you closer to your favorite players and teams.",2024-02-03 22:27:47.766363
/watch?v=N109mlx10NA&pp=ygUKcmFjZSBNaWFtaQ%3D%3D,/@Formula1,FORMULA 1,Every Driver's Miami Entrance! | 2023 Miami Grand Prix,1.2M,8 months,Our drivers were provided with a stunning entrance to the crowd in Miami as Will.I.AM's orchestra played out his new track THE ...,2024-02-03 22:27:47.770639
/watch?v=onBbHqh9clc&pp=ygUKcmFjZSBNaWFtaQ%3D%3D,/@BeatdownRacing,Beatdown Racing,"F1 22 - 100% Race Miami, USA in Chuck Leclerc's Ferrari | PS5",313K,1 year,"Check out this brand new video of F1 22 gameplay on PS5, containing a full 100% race around the Miami Grand Prix circuit!",2024-02-03 22:27:47.773869
/watch?v=vDU8dperEKE&pp=ygUKcmFjZSBNaWFtaQ%3D%3D,/@WorldSailingTV,World Sailing TV,Laser Medal Race | Hempel World Cup Series Miami 2020,29K,4 years,The quest for a medal at Hempel World Cup Series Miami wasn't the only battle ongoing in the Laser fleet. With a North American ...,2024-02-03 22:27:47.782144
/watch?v=TAJu3iIT19M&pp=ygUKcmFjZSBNaWFtaQ%3D%3D,/@Thedroneracingleague,Drone Racing League,Drone Racing League's Miami 30FLY Finals,14K,Streamed 9 months,CHAMPIONSHIP DRONE RACE Watch the FINAL race of the 2022-23 DRL @Algorand World Championship Season ...,2024-02-03 22:27:47.786837
/watch?v=uzQkfY6uUAc&pp=ygUKcmFjZSBNaWFtaQ%3D%3D,/@CLASHENDURANCE,CLASH Endurance,CLASH Miami Men's & Women's Professional Athlete Race - Full Livestream,10K,1 year,A professional field consisting of Olympians and triathlon champions from around the globe showcased incredible skill at the ...,2024-02-03 22:27:47.790352
/watch?v=3PYT921Ft48&pp=ygUKcmFjZSBNaWFtaQ%3D%3D,/@Hannahtharrell,Hannah Harrell,VLOG: F1 Miami Grand Prix,78K,8 months,"My first ever Formula 1 race eeekkkkkk best weekend of my life,, so so thankful for this experience and for you guys wow ily ...",2024-02-03 22:27:47.793512
/watch?v=ZoxGJgBFtNo&pp=ygUKcmFjZSBNaWFtaQ%3D%3D,/@MiamiVice,Miami Vice,The Powerboat Race | Miami Vice,64K,3 years,"During the race with a drug dealer McCarthy, Crockett, Tubbs, and Zito discover how he smuggles his drugs into Miami - by using ...",2024-02-03 22:27:47.796373
/watch?v=GTifvVZBNWs&pp=ygUKcmFjZSBNaWFtaQ%3D%3D,/@Thedroneracingleague,Drone Racing League,"32BitsOfGil, Fastest Lap, Miami | Drone Racing League",479K,6 years,"Fastest Lap: 32BitsOfGil, 00:53.5, Miami Nights DRL is the premiere professional race series for FPV drone racing.",2024-02-03 22:27:47.799350
/watch?v=KoATyC_nUVE&pp=ygUKcmFjZSBNaWFtaQ%3D%3D,/@Ferrari,Ferrari,"Ferrari Challenge North America Trofeo Pirelli - Homestead-Miami, Race 1",14K,Streamed 10 months,Watch all of the Ferrari Challenge action live from the Homestead-Miami Speedway. #Ferrari488ChallengeEvo ...,2024-02-03 22:27:47.802414
/watch?v=OajteERv3GE&pp=ygUKcmFjZSBNaWFtaQ%3D%3D,/@BSport320,B Sport,F1 2023 - Race 5 Miami GP - Updates,7K,8 months,Let's have a closer look at which updates teams brought for Baku and Miami! Why did some teams delay updates to the Miami GP ...,2024-02-03 22:27:47.805314
/watch?v=qlmhlyd8bZY&pp=ygUKcmFjZSBNaWFtaQ%3D%3D,/@libertysquarerising4711,Liberty Square Rising,"LIBERTY SQUARE: Power, History, & Race in Miami",126K,7 years,"On January 29, 2015, Miami-Dade County Mayor Carlos Gimenez announced that Liberty Square, one of the country's oldest ...",2024-02-03 22:27:47.808031
/watch?v=MgeeicqcFmo&pp=ygUKcmFjZSBNaWFtaQ%3D%3D,/@s1krrafa,S1KRRAFA,STREET RACING IN MIAMI FLORIDA - PART TWO (FINAL),2.4K,11 months,Socials: Instagram.com/s1krrafa https://www.facebook.com/mrs1krr?mibextid=LQQJ4d Cameras And Gadgets - Insta 360 X3 ...,2024-02-03 22:27:47.810521
/watch?v=an6P9CHchnU&pp=ygUKcmFjZSBNaWFtaQ%3D%3D,/@KymIllman,Kym Illman,Off to Miami for F1's newest race,109K,1 year,"It was off to Miami for the brand new F1 Miami 2022 Grand Prix race and my journey saw me taking trains, planes and ...",2024-02-03 22:27:47.813624
/watch?v=YjCipcNNXlI&pp=ygUKcmFjZSBNaWFtaQ%3D%3D,/@TheLateLateShow,The Late Late Show with James Corden,James Takes Over McLaren Racing at Miami Grand Prix,3.7M,1 year,James Corden jetted to Miami to meet drivers Lando Norris and Daniel Ricciardo and the McLaren Racing team for the Formula ...,2024-02-03 22:27:47.816377
/watch?v=6ECNH-pf1b0&pp=ygUKcmFjZSBNaWFtaQ%3D%3D,/@theprofessional155,TheProfessional,"Hitman 3- Part 9 Sabotaging The Race ( Miami Master Difficulty, Silent Assassin )",41K,3 years,Party 9 of my playthrough of Hitman. On this part Agent 47 goes to Miami to take out Robert And Sierra Knox. Support me on ...,2024-02-03 22:27:47.819130
/watch?v=Iw6Q-5RIGTs&pp=ygUKcmFjZSBNaWFtaQ%3D%3D,/@GDAWG803,GDAWG803,"MIAMI NIGHTS 3 : Donkmaster , 2fly vs Macho | WILD UNSEEN MLK WEEKEND FOOTAGE | Donk Racing 2024",29K,5 days,"MLK WEEKEND in South Florida is always a vibe! See just how they do it in the land of the Donks , the 305! Donkmaster pulls up ...",2024-02-03 22:27:58.010677
/watch?v=XjDFGDoc228&pp=ygUKcmFjZSBNaWFtaQ%3D%3D,/@osrn2,OSRN 2,2002 CART Grand Prix Americas at Miami Race,6.7K,4 years,Round 16 of the 2002 CART Season at Bayfront Park in Miami. This is the full version of this race as most of the CBS affiliates that ...,2024-02-03 22:27:58.013542
/watch?v=5cG3K82aQsA&pp=ygUKcmFjZSBNaWFtaQ%3D%3D,/@MikeSupercarsTopSpeed,Mike Supercars TopSpeed,Lamborghini Street Racing Aventador vs Huracan vs Murcielago Lambos Flying in Miami BullFest,216K,6 years,Best of supercar sound EVER.Lamborghini Veneno and 100+ Lambos STREET RACING in Miami. Lamborghini Aventador vs ...,2024-02-03 22:27:58.016479
/watch?v=lvohCMpphZk&pp=ygUKcmFjZSBNaWFtaQ%3D%3D,/@Formula1,FORMULA 1,Mejores Momentos | Gran Premio de Miami 2023,259K,8 months,"Checo Pérez comenzaba en la pole, su compañero de equipo y rival, Max Verstappen, en novena posición. Revive los momentos ...",2024-02-03 22:27:58.020983
/shorts/bZx4MARJqHM,/@LiveTheDash,Live The Dash,MIAMI BEACH IS RUNNING OUT OF SAND 🇺🇸 #shorts,9.3M,1 year,MIAMI BEACH IS RUNNING OUT OF SAND THE SAND ON MIAMI SOUTH BEACH GETS IMPORTED EVERY YEAR IT ...,2024-02-03 22:27:58.024018
/watch?v=G9p62hiP2pE&pp=ygUKcmFjZSBNaWFtaQ%3D%3D,/@Formula1,FORMULA 1,"Leclerc's Crash, Verstappen's Charge & The Top 10 Onboards | 2023 Miami Grand Prix | Qatar Airways",505K,8 months,"Watch incredible onboard action, including 360° footage, of the major moments from a thrilling weekend in Miami - presented by ...",2024-02-03 22:27:58.027055
/watch?v=lWB0x5YZPXw&pp=ygUKcmFjZSBNaWFtaQ%3D%3D,/@NorCalCycling,NorCal Cycling,Will This Change Criterium Racing Forever? (NCL Miami Beach PRO race),63K,8 months,Performance Bike helps support this channel: performancebike.com Instagram: https://www.instagram.com/norcal.cycling/ Send ...,2024-02-03 22:27:58.029924
/watch?v=pNZ3rMAk95A&pp=ygUKcmFjZSBNaWFtaQ%3D%3D,/@DmitarVuckovic,Dmitar Vučković,2022 Miami F1 GP turn 1 race start,8K,1 year,F1 at the Miami Grand Prix east grandstand first lap.,2024-02-03 22:27:58.032752
/shorts/hAUUy_wdKMU,/@SF1UHI,SF1UHI,Max Verstappen Response to Being Booed in Miami is Top Tier 🥶😂🤌 #f1 #shorts #maxverstappen,205K,8 months,Max Verstappen's response to being booed in Miami after the race ...,2024-02-03 22:27:58.035790
/watch?v=i9OCWcaW8gw&pp=ygUKcmFjZSBNaWFtaQ%3D%3D,/@Ferrari,Ferrari,Miami GP - Race beats,9.1K,1 year,Our first time in Miami! Relive the race with our #RaceBeats! #essereFerrari #F1 #MiamiGP Follow us on Facebook ...,2024-02-03 22:27:58.038866
/watch?v=HSa496URPdk&pp=ygUKcmFjZSBNaWFtaQ%3D%3D,/@MiamiVice,Miami Vice,Racing Car Driver Crashes Into A Wall | Miami Vice,32K,2 years,"Epic Chase on Miami Vice! Danny wins the Grand Prix, then the police begin chasing Frank. Despite having a clearly faster and ...",2024-02-03 22:27:58.041630
/watch?v=Vu7B5JCDiUE&pp=ygUKcmFjZSBNaWFtaQ%3D%3D,/@BeatdownRacing,Beatdown Racing,F1 23 - Let's Make Leclerc World Champion #5: 100% Race Miami,23K,7 months,"Check out this brand new video of F1 23 gameplay on PC, containing a full 100% race in my F1 game series with 2023 Ferrari ...",2024-02-03 22:27:58.044523
/watch?v=W8wLM7fH5v0&pp=ygUKcmFjZSBNaWFtaQ%3D%3D,/@AfricanDiasporaNews,African Diaspora News Channel,South Miami Race Soldiers Target Innocent Brotha & Started Putting Hands On Him,35K,8 months,Phillip Scot reports on South Miami race soldiers targeting an innocent Brotha. The Brotha has filed a lawsuit.,2024-02-03 22:28:05.791596
/watch?v=HeGVB0ZXGtQ&pp=ygUKcmFjZSBNaWFtaQ%3D%3D,/@Ferrari,Ferrari,"Ferrari Challenge North America Trofeo Pirelli - Homestead-Miami, Race 2",7.4K,Streamed 10 months,Watch all of the Ferrari Challenge action live from the Homestead-Miami Speedway. #Ferrari488ChallengeEvo ...,2024-02-03 22:28:05.793409
/watch?v=ePiZ6aIusQQ&pp=ygUKcmFjZSBNaWFtaQ%3D%3D,/@NASCAR,NASCAR,NASCAR Sprint Cup Series - Full Race - 2014 Ford EcoBoost 400 at Miami,283K,Streamed 9 years,"Watch the complete race from Miami on November 16, 2014. For more NASCAR news, check out: http://www.NASCAR.com.",2024-02-03 22:28:05.794826
/watch?v=xlOA2gGav5c&pp=ygUKcmFjZSBNaWFtaQ%3D%3D,/@WSeriesOfficial,W Series,W Series Miami | Race 1 Highlights,63K,1 year,"Our first race of 2022 was the first race ever to take place on the brand new Miami International Autodrome circuit. Crashes, safety ...",2024-02-03 22:28:05.797348
/watch?v=OayHVY4C8mc&pp=ygUKcmFjZSBNaWFtaQ%3D%3D,/@bib48_movieclips,Bib48_MovieClips,Miami Vice - boat race,24K,4 years,"""Miami Vice"" S01E05 (1984) - starring: Don Johnson, Phillip Michael Thomas CREDITS: NBC Universal Television Distribution ...",2024-02-03 22:28:05.798596
/watch?v=J0Q-dwuxK-s&pp=ygUKcmFjZSBNaWFtaQ%3D%3D,/@JohnnyFPV,Johnny FPV,Redbull f1 takes Miami - Johnny FPV,132K,1 year,"Formula 1, I would like to introduce you to FPV.. Red Bull f1 car in the streets of Miami was just the coolest thing ever. Also one of ...",2024-02-03 22:28:05.799822
/watch?v=GZmLneIt4kE&pp=ygUKcmFjZSBNaWFtaQ%3D%3D,/@tracksideTalk,tracksideTalk,Lewis Hamilton interview pre-race at Miami Grand Prix,36K,8 months,f1 #formula1 #formulaone #miamigp #miamigrandprix #lewishamilton #lewishamilton44 #mercedesamgf1team.,2024-02-03 22:28:05.802428
/watch?v=Pbl3wTV5zys&pp=ygUKcmFjZSBNaWFtaQ%3D%3D,/@NASCARonFOX,NASCAR on FOX,Winner's Weekend: Miami | NASCAR RACE HUB,9.4K,2 years,William Byron wins his 2nd career NASCAR Cup Series win at Homestead-Miami Speedway in this edition of Winner's Weekend.,2024-02-03 22:28:05.803840
/watch?v=G7J04gWvVaI&pp=ygUKcmFjZSBNaWFtaQ%3D%3D,/@cemexusa,Cemex USA,Race through CEMEX's Flagship Quarry in Miami,729,1 year,"At CEMEX, we're committed to be an active, responsible member of the communities where we live and operate. As a producer of ...",2024-02-03 22:28:05.805122
/watch?v=NuBRjCqDsdI&pp=ygUKcmFjZSBNaWFtaQ%3D%3D,/@redbull,Red Bull,Sergio Perez Drives F1 Car Through New York City,2.9M,1 year,Sergio Perez races through the streets of New York City in the @redbullracing RB7 Formula 1 car on his way to Florida for the ...,2024-02-03 22:28:05.806512
/shorts/oJl8jR85_No,/@BattleBronco,BattleBronco,"M-I-A-M-I, Running out of time! 🏃#roblox #viral",6.8M,7 months,"M-I-A-M-I, Running out of time by Vivo! Roblox Brookhaven RP Skit!  #roblox #viral.",2024-02-03 22:28:05.807885
/watch?v=h9duhESjbEI&pp=ygUKcmFjZSBNaWFtaQ%3D%3D,/@Formula1,FORMULA 1,F1 LIVE: Miami Grand Prix Post Race Show,291K,Streamed 8 months,"Join us LIVE in Miami as we go over all the big moments and talking points from the Miami Grand Prix. For more F1® videos, visit ...",2024-02-03 22:28:05.810304
/watch?v=FI8SgbQUYgI&pp=ygUKcmFjZSBNaWFtaQ%3D%3D,/@Formula1,FORMULA 1,Hamilton & Russell Duel In Miami | 2022 Formula 1 Season,263K,1 year,"Lewis Hamilton and George Russell put on a show as they went wheel-to-wheel at our first race in Miami! For more F1® videos, ...",2024-02-03 22:28:05.811696
/watch?v=5k7yzMyItY0&pp=ygUKcmFjZSBNaWFtaQ%3D%3D,/@MotorsportsonNBC,Motorsports on NBC,NASCAR Truck Series Playoff Race at Homestead-Miami | HIGHLIGHTS | 10/22/22 | Motorsports on NBC,31K,1 year,"NBC Sports – the home of motorsports – features unparalleled motorsports programming, fueled by the network's new media ...",2024-02-03 22:28:05.813498
/watch?v=tnClIznqzU8&pp=ygUKcmFjZSBNaWFtaQ%3D%3D,/@YahooFinance,Yahoo Finance,Why Miami’s Formula 1 race benefits the sport and big brands,1.1K,1 year,"About Yahoo Finance: At Yahoo Finance, you get free stock quotes, up-to-date news, portfolio management resources, ...",2024-02-03 22:28:05.814828
/watch?v=bvZzXJqrjwc&pp=ygUKcmFjZSBNaWFtaQ%3D%3D,/@WorldSailingTV,World Sailing TV,470 Men Medal Race | Hempel World Cup Series Miami 2020,42K,4 years,"With points tight and winds light, 470 Men's gold was up for grabs at Hempel World Cup Series Miami! Follow World Sailing ...",2024-02-03 22:28:05.816073
/watch?v=kC5KyHeaQ0c&pp=ygUKcmFjZSBNaWFtaQ%3D%3D,/@CBSMiami,CBS Miami,Miami Couple To Participate In New Season Of The Amazing Race,1K,1 year,"Luis Colon (34, firefighter) and Michelle Burgos (34, dancer), married from Miami, will be one of 12 teams participating in the ...",2024-02-03 22:28:05.817421
